Key,Key Description,Type,Valid Values,DependsOn,Required,Source,Parent
platformLocation,"The name of the laboratory, facility, vendor, company, or location where the data generation platform was located, provided by the data contributor",,"OtherPlatformLocation,Unknown,Not collected,Not applicable,Not Specified",,True,Sage Bionetworks,DataProperty
technologyPlatformVersion,"The specific version (application, manufacturer, model, lab, etc.) of a technology that is used to carry out a laboratory or computational experiment.",,"10x Visium Spatial Gene Expression,Affymetrix Genome-Wide Human SNP 5.0 Array,Affymetrix Genome-Wide Human SNP 6.0 Array,Affymetrix Human Gene 1.0 ST Array,Affymetrix Human Genome U133 Plus 2.0 Array,Affymetrix U133AB,Agilent 44Karray,BGISEQ-500,Bionano Irys,Cherry Imaging FACE Platform,Cherry Imaging TRACE Platform,Chromium X,EnVision 2103 Multiplate Reader,Illumina 1M,Illumina Genome Analyzer IIx,Illumina h650,Illumina HiSeq 2000,Illumina HiSeq 2500,Illumina HiSeq 3000,Illumina HiSeq 4000,Illumina HiSeq X,Illumina Human660W-Quad v1.0 BeadChip,Illumina HumanHap300,Illumina HumanMethylation450,Illumina HumanOmni1-Quadv1.0,Illumina HumanOmniExpress-24 v1.0 BeadChip,Illumina HumanOmniExpress-24 v1.2 BeadChip,Illumina Infinium MethylationEPIC BeadChip v1.0 (850k),Illumina Infinium MethylationEPIC BeadChip v2.0 (935k)Illumina MiSeq,Illumina MouseWG-6 v2.0 expression BeadChip,Illumina NextSeq 1000,Illumina NextSeq 2000,Illumina NextSeq 500,Illumina NextSeq 550,Illumina NovaSeq 6000,Illumina Omni2pt5M,Illumina Omni5M,Illumina WholeGenome DASL,Infinium HumanOmniExpressExome,LI-COR Odyssey CLx,LifeViz Infinity System,LifeViz Micro System,LTQ Orbitrap XL,Nanostring Counter,Nanostring GeoMx,Olympus DP80,Orbitrap Fusion Lumos Tribrid,PacBio RS II,PacBio Sequel II System,PacBio Sequel IIe System,Perlegen 300Karray,Promega GloMax Discover,Q Exative HF,scale,Spectramax M Series,Vectra H1 3D Imaging System,Vevo 3100 Imaging System,Zeiss LSM 980,OtherTechnologyPlatformVersion,Unknown,Not collected,Not applicable,Not Specified",,True,Sage Bionetworks,DataProperty
dataFile,"The data file provides the name of the raw file generated by the instrument. The data files can be instrument raw files but also converted peak lists such as mzML, MGF or result files like mzIdentML.",,"Unknown,Not collected,Not applicable,Not Specified",,True,Proteomics Sample Metadata,DataProperty
acquisitionMode,"The specific aspect of a mass spectrometer method by which mass ranges are selected and possibly dissociated (full scan, MSn, SIM, MRM, etc.).",,"Unknown,Not collected,Not applicable,Not Specified",,True,https://www.ebi.ac.uk/ols/ontologies/ms/termsiri=http%3A%2F%2Fpurl.obolibrary.org%2Fobo%2FMS_1003213,DataProperty
acquisitionSoftware,The name of the acquisition software used,,"Unknown,Not collected,Not applicable,Not Specified",,True,http://purl.obolibrary.org/obo/MS_1001455,DataProperty
databaseName,"The name of the search database (nr, SwissProt or est_human, and/or mass spectral library).",,"MassBank of North America (MoNA),NIST17,Metlin,HMDB,OtherDatabaseName,Unknown,Not collected,Not applicable,Not Specified",,True,http://purl.obolibrary.org/obo/MS_1001013,DataProperty
databaseSource,"The name of the organization, project, or laboratory from where the database is obtained (UniProt, NCBI, EBI, other).",,"OtherDatabaseSource,Unknown,Not collected,Not applicable,Not Specified",,False,http://purl.obolibrary.org/obo/MS_1001012,DataProperty
digestionMethod,"The type of digestion - in-solution, in-gel, etc. (ex. ""in-gel digestion"")",,"in-solution,in-gel,OtherDigestionMethod,Unknown,Not collected,Not applicable,",,True,"DSLWG,Sage Bionetworks",DataProperty
msAnalyteType,the type of biospecimen subjected to analysis,,"Protein,metabolite,Lipid,Other,Unknown,Not collected,Not applicable,Not Specified",,False,http://purl.obolibrary.org/obo/NCIT_C156434,DataProperty
msAnalyzerTypeMS1,"Describes the mass spectrometer analyzer used to read out parent ions (quadrupole, ion-trap, time-of-flight, FT-ICR, including combinations of these for hybrid instruments)",,"LTQ Orbitrap XL,Orbitrap Fusion,Orbitrap Fusion Lumos,Q Exactive,Q Exactive HF,Q Exactive HF-X,Q Exactive Plus,Exploris 240Exploris 480quadrupole time-of-flight,time-of-flight,triple quadrupole,Xevo G2 QTOF,Xevo TQ-S,Bruker Avance IIITimsTOF ProOtherMsAnalyzerTypeMS1,Unknown,Not collected,Not applicable,Not Specified",,True,"Proposed minimum metadata relative to mass spectrometry ,Sage Bionetworks",DataProperty
msAnalyzerTypeMS2,"Describes the mass spectrometer analyzer used to read out fragment ions(quadrupole, ion-trap, time-of-flight, FT-ICR, including combinations of these for hybrid instruments)",,"LTQ Orbitrap XL,Orbitrap Fusion,Orbitrap Fusion Lumos,Q Exactive,Q Exactive HF,Q Exactive HF-X,Q Exactive Plus,Exploris 240Exploris 480quadrupole time-of-flight,time-of-flight,triple quadrupole,Xevo G2 QTOF,Xevo TQ-S,Bruker Avance IIITimsTOF ProOtherMsAnalyzerTypeMS2,Unknown,Not collected,Not applicable,Not Specified",,True,"Proposed minimum metadata relative to mass spectrometry ,Sage Bionetworks",DataProperty
msAssayTechnique,Specified the mass spectrometer technique used,,"DDA-MS,DIA-MS,FIA-MSMS,HPLC-MSMS,LC-MS,LC-MSMS,MDMS-SL,MIB-MS,UPLC-MSMS,UPLC-ESI-QTOF-MS,LC-SRMOtherMsAssayTechnique,Unknown,Not collected,Not applicable,Not Specified",,True,"DSLWG,Sage Bionetworks",DataProperty
msTarget,specifies whether or not a specific molecule(s) is/are targeted for detection/measurement by the assay,,"TargetedMsTarget,UnTargetedMsTarget,Unknown,Not collected,Not applicable,Not Specified",,True,Sage Bionetworks,DataProperty
protoemicsAssayType,Type of peptide quantification used (ex. Label Free),,"Label Free,TMT,ITRAQ,SILAC,Targeted Absolute Quantitation,Other,Unknown,Not collected,Not applicable",,True,"DSLWG,Sage Bionetworks,https://www.ebi.ac.uk/ols/ontologies/pride/termsiri=http%3A%2F%2Fpurl.obolibrary.org%2Fobo%2FPRIDE_0000514&viewMode=All&siblings=false",DataProperty
sampleType,The type of sample collected,,"Amniotic Fluid,Appendix,B cell,Basophils,Bone,Bone Marrow,Brachial lymph node,brain,Breast Milk,Bronchoalveolar Lavage Fluid,Carbohydrate,Cell culture supernatant,cell line,Cerebrospinal Fluid,Cervical lymph nodes,Colon,Colonic Lamina Propria,Convalescent Plasma,Cord blood,Dendritic cell,Dermis,DNA,Dried Blood Spot,Endotracheal aspirate,Epithelium,Feces,Fibroblast,Gastric lamina propria,Ileum,Inguinal lymph node,Jejunum,Kidney,Leukocytes,Lipid,Liver,Lung,Lung lymph node,Lymph node,Lymphocyte,Macrophage,Mesenteric lymph node,Monocyte,Mouse Ear,Nasal lavage fluid,Nasal Swab,Nasal Swab or Nose Specimen,Nasopharyngeal Swab Specimen,Negative Control,Neutrophil,NK cell,Not Specified,Optic Nerve,Organoids,Oropharyngeal Swab Specimen,Osteoblasts,OtherSampleType,Pancreas,Pancreatic Stellate Cells,PBL,PBMC,Placenta,Plasma,Pooled Sample,Popliteal lymph node,Positive Control,Protein,Rectal Swab Specimen,Red Blood Cell,Saliva,Salivary Glands,Serum,Skin of body,Small intestine,Spleen,Sputum,Stomach,Synovial fluid,Synovial tissue,T cell,Thymus,Tonsil,Trachea,Tumor Tissue,Umbilical cord blood,Urinary bladder,Urine,Vagina,Whole blood",,True,"ImmPort,Sage Bionetworks",DataProperty
